{
  "name": "column-line",
  "label": "Column Line",
  "icon": "",
  "sortOrder": 0,
  "isContainer": true,
  "isSystem": true,
  "parents": {
    "defaultPolicy": "deny",
    "allow": ["column-group"]
  },
  "children": {
    "defaultPolicy": "deny",
    "allow": ["column"]
  },
  "appearances": {
    "default": {
      "default": true,
      "label": "Default",
      "masterTemplate": "master/column-line/default.phtml",
      "elements": {
        "main": {
          "tag": "div",
          "attributes": {
            "data-content-type": "column-line",
            "data-appearance": "default"
          },
          "styles": {},
          "cssClasses": ["pagebuilder-column-line"],
          "staticStyles": {
            "display": "flex",
            "width": "100%"
          }
        }
      }
    }
  },
  "defaults": {
    "appearance": "default"
  }
}
