{
  "name": "heading",
  "label": "Heading",
  "icon": "fa-solid fa-heading",
  "menuSection": "elements",
  "sortOrder": 10,
  "isContainer": false,
  "parents": {
    "defaultPolicy": "allow",
    "deny": ["stage"]
  },
  "children": {
    "defaultPolicy": "deny"
  },
  "appearances": {
    "default": {
      "default": true,
      "label": "Default",
      "masterTemplate": "master/heading/default.phtml",
      "elements": {
        "main": {
          "tag": "dynamic",
          "tagSource": "heading_type",
          "attributes": {
            "data-content-type": "heading",
            "data-appearance": "default"
          },
          "styles": {
            "text-align": {"source": "text_align"},
            "border-style": {"source": "border_style", "converter": "borderStyle"},
            "border-color": {"source": "border_color"},
            "border-width": {"source": "border_width"},
            "border-radius": {"source": "border_radius"},
            "display": {"source": "display", "converter": "display"},
            "margin": {"source": "margins_and_padding", "converter": "margins"},
            "padding": {"source": "margins_and_padding", "converter": "paddings"}
          },
          "cssSource": "css_classes"
        }
      }
    }
  },
  "defaults": {
    "appearance": "default",
    "heading_type": "h2",
    "heading_text": "",
    "text_align": ""
  }
}
