{
  "name": "image",
  "label": "Image",
  "icon": "fa-solid fa-image",
  "menuSection": "media",
  "sortOrder": 10,
  "isContainer": false,
  "parents": { "defaultPolicy": "allow", "deny": ["stage"] },
  "children": { "defaultPolicy": "deny" },
  "appearances": {
    "default": {
      "default": true,
      "label": "Default",
      "masterTemplate": "master/image/default.phtml",
      "elements": {
        "main": {
          "tag": "figure",
          "attributes": {
            "data-content-type": "image",
            "data-appearance": "default"
          },
          "styles": {
            "text-align": { "source": "text_align" },
            "border-style": { "source": "border_style", "converter": "borderStyle" },
            "border-color": { "source": "border_color" },
            "border-width": { "source": "border_width" },
            "border-radius": { "source": "border_radius" },
            "display": { "source": "display", "converter": "display" },
            "margin": { "source": "margins_and_padding", "converter": "margins" },
            "padding": { "source": "margins_and_padding", "converter": "paddings" }
          },
          "cssSource": "css_classes"
        }
      }
    }
  },
  "defaults": {
    "appearance": "default",
    "image_url": "",
    "alt_text": "",
    "title_text": "",
    "link_url": "",
    "link_target": "",
    "caption": "",
    "max_width": ""
  }
}
